{
  "$schema": "http://json-schema.org/draft-07/schema#",
  "$id": "./user-signal.json",
  "title": "Enterstellar UserSignal",
  "description": "A user interaction signal dispatched from an EnterstellarZone to the agent. Fire-and-forget with enqueue guarantee.",
  "type": "object",
  "properties": {
    "type": {
      "type": "string",
      "enum": ["click", "submit", "input", "custom"]
    },
    "zone": {
      "type": "string",
      "minLength": 1
    },
    "component": {
      "type": "string",
      "minLength": 1
    },
    "payload": {
      "type": "object",
      "propertyNames": {
        "type": "string"
      },
      "additionalProperties": {}
    },
    "timestamp": {
      "type": "string",
      "minLength": 1
    },
    "correlationId": {
      "type": "string"
    }
  },
  "required": ["type", "zone", "component", "payload", "timestamp"],
  "additionalProperties": false
}
